,user_id,screen_name,name,verified,id,created_at,full_text,retweet_count,favorite_count,hashtags,user_mentions,in_reply_to_user_id,in_reply_to_screen_name,is_quote_status,is_retweet,retweet_og_id,retweet_og_author_id,retweet_og_author_screen_name,retweet_og_author_name,retweet_og_date,retweet_og_full_text,retweet_og_retweet_count,retweet_og_favorite_count
183,29177890,gailmarie1958,Gail older bolder and a tad wiser 🥰🥰,False,1598982077122195456,2022-12-03 10:06:49+00:00,"The silence on twitter about the endemic use of children in the drug industry, the abuse from mental to sexual speaks volumes of how child abuse is used as an agenda and not to protect the children. 

https://t.co/jvmx1RAL6W",2,2,,,,,False,False,,,,,,,,
184,351496958,lbbdcouncil,Barking and Dagenham,True,1598954721645154306,2022-12-03 08:18:07+00:00,"On Mon 5 Dec 3-6pm our health &amp; wellbeing team and the Police will be at Barking Station, to provide information and advice to support you with your mental health &amp; wellbeing, including drug &amp; alcohol abuse and information about local domestic abuse support. #16DaysofActivism https://t.co/xl7u7pWkwh",1,1,16DaysofActivism,,,,False,False,,,,,,,,
185,1243167163566813186,imperiumoon,ᅠ ᅠ ᅠᅠ 𝖈𝐡𝐞𝐫𝐫𝐲 ᅠ ᅠᅠ 𝖇𝐥𝐨𝐧𝐝𝐞,False,1598948689330200576,2022-12-03 07:54:09+00:00,"ᅠᅠ

ᅠᅠᅠᅠ

             𝓲mportant  𝓲nformation.

wont  be  ( 𝙩𝙖𝙜𝙜𝙞𝙣𝙜  𝙩𝙧𝙞𝙜𝙜𝙚𝙧𝙨 ) .   mental  illness ,  self  harm ,  internalised  homophobia ,  foul  language ,  alcohol  &amp;&amp;.  drug  abuse .  depression ,  anxiety .

CAREFUL  BEFORE  INTERACTING

ᅠᅠ

ᅠᅠ",0,0,,,1.2431671635668132e+18,imperiumoon,False,False,,,,,,,,
186,1126407036634390528,onunga254,Confidence has no competition,False,1598946657852600320,2022-12-03 07:46:04+00:00,RT @mr___easy: There will be a  Legal Aid Clinic for the University of Nairobi students. It will aim  aim to provide legal advice to Staff…,5,0,,mr___easy,,,False,True,1.598946243958276e+18,1.1936033403551457e+18,mr___easy,JUST LIKE THAT🇰🇪,2022-12-03 07:44:26+00:00,"There will be a  Legal Aid Clinic for the University of Nairobi students. It will aim  aim to provide legal advice to Staff and Students on Sexual and Reproductive Health and Rights (SRHR), Gender-Based Violence HIV/AIDs and Drug Abuse, Mental Health and Wellness @uonbi #WeAreUoN https://t.co/oaoLMn0eB6",5.0,6.0
187,1193603340355145729,mr___easy,JUST LIKE THAT🇰🇪,False,1598946243958276096,2022-12-03 07:44:26+00:00,"There will be a  Legal Aid Clinic for the University of Nairobi students. It will aim  aim to provide legal advice to Staff and Students on Sexual and Reproductive Health and Rights (SRHR), Gender-Based Violence HIV/AIDs and Drug Abuse, Mental Health and Wellness @uonbi #WeAreUoN https://t.co/oaoLMn0eB6",5,6,WeAreUoN,uonbi,,,False,False,,,,,,,,
188,1585508346060492801,vodkaboooof,.,False,1598940464841134080,2022-12-03 07:21:28+00:00,over the last year ive written 80k words about my character's mental decline into addiction while working for a psychopathic drug lord and suffering abuse at the hands of her exbf....,0,0,,,,,False,False,,,,,,,,
189,782745504576901120,helleborecore,‍ ‍ 𝖀𝑵𝑫𝒀𝑰𝑵𝑮 ‍╳ ‍ 𝓗͟𝓤͟𝓝͟𝓖͟𝓔͟𝓡｡,False,1598930178381529088,2022-12-03 06:40:35+00:00,"⠀⠀

heavy depictions of gore  &amp;&amp;.  violence

ptsd,  truama,  verbal / physical  abuse
drug   abuse,  unhealthy   relationships
stockholm  syndrome,   sexual  themes
torture,   manipulation,   mental  illness
paranoia,  religion,  cults,  cannibalism.

⠀⠀",0,0,,,7.827455045769011e+17,helleborecore,False,False,,,,,,,,
190,1552744168350314496,MartianMaddie1,Maddy R,False,1598897776607522816,2022-12-03 04:31:50+00:00,"@JoshuaPHilll @benegotherit Ppl are excusing Kanye/Ye's behavior on drug abuse and neurodivergency/mental illness, but I've known alot people with both addictions+mental illnesses and it doesn't make you f*cking racist and antisemitic, it just makes you more honest if you held those beliefs to begin with",0,0,,"JoshuaPHilll,benegotherit",1.0907155135866798e+18,JoshuaPHilll,False,False,,,,,,,,
191,983864598720925696,RuthJoy96960173,Ruth Joy,False,1598887991061098496,2022-12-03 03:52:57+00:00,"consequences of abortion as shown by studies, including the increased risk of suicide, drug abuse, exacerbation of preexisting mental illness and PTSD.

Briefing and argument by attorney Ferrara persuaded the Trenton Municipal Court to allow the defense, which the State would",0,1,,,9.838645987209257e+17,RuthJoy96960173,False,False,,,,,,,,
192,1524066205694574593,martyrdous,ᅠ ᅠ ᅠᅠ 𝖒𝐞𝐨𝐰 ᅠ ᅠᅠ 𝖒𝐞𝐨𝐰,False,1598882788752908288,2022-12-03 03:32:17+00:00,"ᅠᅠ

ᅠᅠᅠᅠ

             𝓲mportant  𝓲nformation.

wont  be  ( 𝙩𝙖𝙜𝙜𝙞𝙣𝙜  𝙩𝙧𝙞𝙜𝙜𝙚𝙧𝙨 ) .   mental  illness ,  self harm ,  internalised  homophobia ,  foul  language ,  alcohol  &amp;&amp;.  drug  abuse .  depression ,  anxiety .

CAREFUL  BEFORE  INTERACTING

ᅠᅠ

ᅠᅠ",0,0,,,1.5240662056945746e+18,martyrdous,False,False,,,,,,,,
193,1109094708259643393,Septicsceptic1,Septicsceptic,False,1598855905562759171,2022-12-03 01:45:27+00:00,"@AviWoolf @DouglasLukasik @olg_yaari Although there is room to develop more incisive critiques of Democrats' policies, and a more coherent alternative, on crime

Might be more persuasive if tied to solutions on homelessness, mental health, family/social breakdown and drug abuse too",0,0,,"AviWoolf,DouglasLukasik,olg_yaari",1.1090947082596434e+18,Septicsceptic1,False,False,,,,,,,,
194,1594135994105794563,Kn0wsN0body,N0bodyKn0ws,False,1598841478754668544,2022-12-03 00:48:08+00:00,"@RadCentrism Brain fog can also be attributed to substance abuse, menopause, hysterectomy, pregnancy, anxiety, ADHD, prescription drug side effects, and increased screentime. Curious how the staggering majority of ""LC"" patients are white women over 40 with a history of mental illness.",0,0,,RadCentrism,1.0199978403223798e+18,RadCentrism,False,False,,,,,,,,
195,17030613,OnPointNews,On Point News,False,1598829493011255296,2022-12-03 00:00:30+00:00,@tomleykis No drug user deserves to die. Some of these people had a history of trauma and abuse and may have self-medicated to dull the pain. The real blame lies with a society that has preferred to fight pointless drug wars rather than focus on prevention and mental health care.,0,0,,tomleykis,171191577.0,tomleykis,False,False,,,,,,,,
196,168694077,RogReview,Rogersville Review,False,1598801702815244298,2022-12-02 22:10:04+00:00,The Tennessee Department of Mental Health and Substance Abuse Services is excited to expand a proven program for reversing drug overdoses and connecting patients to addiction treatment to more parts of the state. https://t.co/y9zcxts5V7,0,0,,,,,False,False,,,,,,,,
197,18731084,mmmaustin,MMMurray 🔨,False,1598795526778101760,2022-12-02 21:45:32+00:00,@GregAbbott_TX These drugs are taken illegally?. What don’t we address drug abuse and mental health?,0,1,,GregAbbott_TX,90651198.0,GregAbbott_TX,False,False,,,,,,,,
198,1593387468694474752,BlasterLeford,Galician fella,False,1598781113908043776,2022-12-02 20:48:16+00:00,@PaulConRO Drug abuse often causes mental diseases.,0,1,,PaulConRO,1.5202767286435717e+18,PaulConRO,False,False,,,,,,,,
199,1586154637832462338,Crystal80179462,Crystal,False,1598774749781495811,2022-12-02 20:22:58+00:00,"@JermynMan Harry has been in need of mental help and his family tried many times. Therapy, rehab for drug abuse and booze, etc. I think that someone needs to put him away and God only knows what sort of drugs he's on.",0,1,,JermynMan,7.261152864876954e+17,JermynMan,False,False,,,,,,,,
200,1367646891916288000,MaryWordsworth1,Mary Stockton,False,1598744437349236736,2022-12-02 18:22:31+00:00,"@joncoopertweets Satan is always available to corrupt mankind’s freewill!Hitler was evil by an extreme mental illness,drug abuse,&amp;the need to be popular by scapegoating the Jews-sound familiar!Satan gets a grip on evil choices-the next thing you know someone’s looking Armageddon(Trump/Putin)🙄💦",0,0,,joncoopertweets,27493883.0,joncoopertweets,False,False,,,,,,,,
201,823244376063229952,copper90000,Jery Smith,False,1598739484207714318,2022-12-02 18:02:50+00:00,"@DerbyGrouch @NikkiHaley Derby, so are you saying that it’s Americans duty to hand over our country to bands of ILLEGAL ALIENS and throw in Drug Dealers, Terrorists and Coyotes who abuse women and children!!! Liberalism is a Huge Mental Disorder!!!",0,0,,"DerbyGrouch,NikkiHaley",2445536036.0,DerbyGrouch,False,False,,,,,,,,
202,1494320569461866504,jarchivistquote,Jonathan Sims Quote Bot,False,1598739083718557696,2022-12-02 18:01:15+00:00,"I never thought I’d miss those days, when I could throw out some half-baked speculation about drug abuse or mental illness and whoosh- away all the statements went.",0,0,,,,,False,False,,,,,,,,
203,1202375826974613504,imissmylefluers,☄,False,1598733623875739648,2022-12-02 17:39:33+00:00,why is he acting this way? brain damage/cte? mental health problems from or strengthened by drug abuse? has he seen hell on earth his own two eyes and is trying to figure out how to navigate the world with that information? something else?,0,0,,,1.2023758269746135e+18,imissmylefluers,False,False,,,,,,,,
204,767792857,MitziNichelle,Mitzi🖤,False,1598723687917592579,2022-12-02 17:00:04+00:00,"I was raised in this way. It fcked me up! I hated it! I didn’t want to live.. AS A KID!! Over sharing &amp; over extending responsibility on us.Raised by my older brothers, knew all too well abt financial burdens, abuse, drug use &amp; mental instability. TY for sharing.. this is REAL 💯 https://t.co/iKTd8Hd3LQ",0,0,,,,,True,False,,,,,,,,
205,50875567,JAM661,Jenifer Markoe,False,1598723393544765441,2022-12-02 16:58:54+00:00,@LindaCheekMD @CMerandi Addiction is a mental illness and has nothing to do with toxic whatever. Addict abuse drug to numb there mind because they do not want to deal with there emotions and like the feeling. For someone who does not think thing though due to age it becomes a easy out.,0,0,,"LindaCheekMD,CMerandi",456857713.0,LindaCheekMD,False,False,,,,,,,,
206,1331840126549327874,ScienceAccount1,Fact Checker of False Facts,False,1598723335164416000,2022-12-02 16:58:40+00:00,"@ElisabettaLeni @MKushel @VPrasadMDMPH Dignity: How does someone have more dignity if they’re continually to struggle with drug abuse/mental health? 

Long-term solution: The issue of homelessness isn’t that people are homeless -It’s the issue of WHY. How does unconditional housing address LT drug abuse/mental health?",0,0,,"ElisabettaLeni,MKushel,VPrasadMDMPH",1.4818973307690762e+18,ElisabettaLeni,False,False,,,,,,,,
207,1565864243051757569,rrooobbbbb,rrooobbbbb,False,1598719146749005829,2022-12-02 16:42:02+00:00,"@FoxNews guns dont grow up with mental health issues, cutting, drug abuse and prison from abuse",0,5,,FoxNews,1367531.0,FoxNews,False,False,,,,,,,,
208,1163364545370439680,Koplo__,Koplo,False,1598708085668941826,2022-12-02 15:58:04+00:00,RT @CrimeSiPoaKenya: Drug abuse has pushed so many young people to the edge. From mental illness to so many gender-based violence cases and…,3,0,,CrimeSiPoaKenya,,,False,True,1.598701075401425e+18,1.0506350220787917e+18,CrimeSiPoaKenya,CrimeSiPoaKenya,2022-12-02 15:30:13+00:00,"Drug abuse has pushed so many young people to the edge. From mental illness to so many gender-based violence cases and suicide. Our generation is going through a lot. We must stand together and fight against drugs &amp; substance abuse as well as #StopGBV 
#16DaysOfActivisim https://t.co/6avEcOPqlo",3.0,6.0
209,1402003840401039360,Bitemefuker,Bitey Bitch 🩸,False,1598706191634288641,2022-12-02 15:50:33+00:00,"@PurgeRebel Over these past couple of years, I've seen more alcoholics, drug abuse, and mental instability blossom than I ever thought possible.",0,1,,PurgeRebel,1.5172616140171715e+18,PurgeRebel,False,False,,,,,,,,
210,1341706519151304706,WAT_Kenya,Women Against Terrorism,False,1598701829390446592,2022-12-02 15:33:13+00:00,RT @CrimeSiPoaKenya: Drug abuse has pushed so many young people to the edge. From mental illness to so many gender-based violence cases and…,3,0,,CrimeSiPoaKenya,,,False,True,1.598701075401425e+18,1.0506350220787917e+18,CrimeSiPoaKenya,CrimeSiPoaKenya,2022-12-02 15:30:13+00:00,"Drug abuse has pushed so many young people to the edge. From mental illness to so many gender-based violence cases and suicide. Our generation is going through a lot. We must stand together and fight against drugs &amp; substance abuse as well as #StopGBV 
#16DaysOfActivisim https://t.co/6avEcOPqlo",3.0,6.0
211,822331036562358272,WeeHughie1973,WeeHughie,False,1598701647710294017,2022-12-02 15:32:29+00:00,"@SwampLifeCowgrl @FoxNews The guy who believes progressivism leads to drug abuse, homelessness and mental addiction? Yeah he’s a great person to quote! Lmao! All opinions based on feelings to manipulate the easily gullible!!",0,0,,"SwampLifeCowgrl,FoxNews",1.1593479538631475e+18,SwampLifeCowgrl,False,False,,,,,,,,
212,1050635022078791680,CrimeSiPoaKenya,CrimeSiPoaKenya,False,1598701075401424896,2022-12-02 15:30:13+00:00,"Drug abuse has pushed so many young people to the edge. From mental illness to so many gender-based violence cases and suicide. Our generation is going through a lot. We must stand together and fight against drugs &amp; substance abuse as well as #StopGBV 
#16DaysOfActivisim https://t.co/6avEcOPqlo",3,6,"StopGBV,16DaysOfActivisim",,,,False,False,,,,,,,,
213,1156314423730081792,KeithCo30475934,Keith Cook,False,1598699272718778369,2022-12-02 15:23:03+00:00,"@ViviAnneHunt Just needs to be edited.
The old man was a biker in the 50s.
Grew up around bikers and mafia by a single mother of 5 which lead to mental health, drug abuse, failed suicides.
Roberta was killed by Ryke at 9 months pregnant.
They put her in my cousins trunk and discarded her bidy",0,2,,ViviAnneHunt,1.4949833536946708e+18,ViviAnneHunt,False,False,,,,,,,,
214,1595888509868548103,Smegma_Variant,Smegma Variant,False,1598688288935759873,2022-12-02 14:39:24+00:00,"@bluorredpil @hankowitzz @ClownWorld_ All I know is there is wanton homelessness, rampant drug abuse, human trafficking, pedophilia, sexual abuse of children, promulgation of mental illness, a genocode against the unborn, wholesale acceptance of violent anti-white racism, etc. under the current regime...",0,0,,"bluorredpil,hankowitzz,ClownWorld_",2538109626.0,bluorredpil,False,False,,,,,,,,
215,824004742087081985,LorettaBower3,@LorettaBower@mastodon.world,False,1598665780593188864,2022-12-02 13:09:58+00:00,RT @JeffWeinerOS: @martinecomas Greenberg was also sentenced to 10 years of supervision upon release. He'll be required to submit to drug t…,20,0,,"JeffWeinerOS,martinecomas",,,False,True,1.5983811280287212e+18,172565308.0,JeffWeinerOS,Jeff Weiner,2022-12-01 18:18:52+00:00,"@martinecomas Greenberg was also sentenced to 10 years of supervision upon release. He'll be required to submit to drug testing and treatment for substance abuse and his mental health issues. He's also been designated a sex offender. 

https://t.co/rF3wpWG9V8",20.0,65.0
216,723255965475172352,gcramer30,Geoffrey Cramer,False,1598652500277698560,2022-12-02 12:17:12+00:00,@jorymicah I once suggested tiny home communities with direct access to mental health as a requirement. It goes back to what made a person homeless. Poor mental health. Drug addiction or drug abuse. An inability to live normal enough to maintain a living situation. Maybe we find out what up,0,0,,jorymicah,7.232559654751724e+17,gcramer30,False,False,,,,,,,,
217,1188371744706437122,keshy_grace,Mademoiselle Keshy😊✨,False,1598601027388948480,2022-12-02 08:52:40+00:00,"RT @DiscoverJKUAT: Hon. Ezekiel Machogu, CS Education: The wellbeing of our society is at stake, partly due to the challenge of alcohol and…",5,0,,DiscoverJKUAT,,,False,True,1.5985809305363456e+18,73829129.0,DiscoverJKUAT,Discover JKUAT,2022-12-02 07:32:48+00:00,"Hon. Ezekiel Machogu, CS Education: The wellbeing of our society is at stake, partly due to the challenge of alcohol and drug abuse.  This has seriously compromised the productivity and mental health of our youth.... ^DP  @StandardKenya  #JKUATPAUGrad2022",5.0,2.0
218,1444644658253082624,bredo_kot,KOT POLICE 🚨™,False,1598600306933350400,2022-12-02 08:49:48+00:00,"RT @DiscoverJKUAT: Hon. Ezekiel Machogu, CS Education: The wellbeing of our society is at stake, partly due to the challenge of alcohol and…",5,0,,DiscoverJKUAT,,,False,True,1.5985809305363456e+18,73829129.0,DiscoverJKUAT,Discover JKUAT,2022-12-02 07:32:48+00:00,"Hon. Ezekiel Machogu, CS Education: The wellbeing of our society is at stake, partly due to the challenge of alcohol and drug abuse.  This has seriously compromised the productivity and mental health of our youth.... ^DP  @StandardKenya  #JKUATPAUGrad2022",5.0,2.0
219,310028318,VinaigretteGirl,"Dr. Rejoiner, #NotMovingOn,💙",False,1598599460254355456,2022-12-02 08:46:26+00:00,"@thomasafine @natsechobbyist @MuellerSheWrote Exploiting mental illness for financial gain is one of the most horrendous aspects of my natal country’s culture. From reality TV to opiates to genderism to mainstreamed drug addiction, kink, &amp; pedophilic abuse as fashion &amp; entertainment at street festivals, it’s all about $$$$$.",0,0,,"thomasafine,natsechobbyist,MuellerSheWrote",18641880.0,thomasafine,False,False,,,,,,,,
220,267946772,IamNLawrence,#GENERALELECTIONNOW,False,1598598255889227776,2022-12-02 08:41:39+00:00,"This blameless woman had no idea she had an absolute psychopath as a child. Raised in a society that encourages individuals to possess weapons, because it fails to keep them safe. 

A society that encourages violence, drug addiction and mental abuse in children.",0,0,,,267946772.0,IamNLawrence,False,False,,,,,,,,
221,1126407036634390528,onunga254,Confidence has no competition,False,1598596464707399680,2022-12-02 08:34:32+00:00,"RT @DiscoverJKUAT: Hon. Ezekiel Machogu, CS Education: The wellbeing of our society is at stake, partly due to the challenge of alcohol and…",5,0,,DiscoverJKUAT,,,False,True,1.5985809305363456e+18,73829129.0,DiscoverJKUAT,Discover JKUAT,2022-12-02 07:32:48+00:00,"Hon. Ezekiel Machogu, CS Education: The wellbeing of our society is at stake, partly due to the challenge of alcohol and drug abuse.  This has seriously compromised the productivity and mental health of our youth.... ^DP  @StandardKenya  #JKUATPAUGrad2022",5.0,2.0
222,1561438295724277769,Otienoh_,Outis,False,1598595317410177024,2022-12-02 08:29:58+00:00,"RT @DiscoverJKUAT: Hon. Ezekiel Machogu, CS Education: The wellbeing of our society is at stake, partly due to the challenge of alcohol and…",5,0,,DiscoverJKUAT,,,False,True,1.5985809305363456e+18,73829129.0,DiscoverJKUAT,Discover JKUAT,2022-12-02 07:32:48+00:00,"Hon. Ezekiel Machogu, CS Education: The wellbeing of our society is at stake, partly due to the challenge of alcohol and drug abuse.  This has seriously compromised the productivity and mental health of our youth.... ^DP  @StandardKenya  #JKUATPAUGrad2022",5.0,2.0
223,912413852083597315,MagazetiOnline,Magazeti Online,False,1598593870689869826,2022-12-02 08:24:13+00:00,"StandardKenya: @DiscoverJKUAT Hon. Ezekiel Machogu, CS Education: The wellbeing of our society is at stake, partly due to the challenge of alcohol and drug abuse.  This has seriously compromised the productivity and mental health of our youth.... ^DP    … https://t.co/pQs8TV4pQh",0,0,,DiscoverJKUAT,,,False,False,,,,,,,,
224,53037279,StandardKenya,The Standard Digital,True,1598582501936484352,2022-12-02 07:39:03+00:00,"@DiscoverJKUAT Hon. Ezekiel Machogu, CS Education: The wellbeing of our society is at stake, partly due to the challenge of alcohol and drug abuse.  This has seriously compromised the productivity and mental health of our youth.... ^DP    #JKUATPAUGrad2022 https://t.co/Z5F7Fjtv9U",0,0,JKUATPAUGrad2022,DiscoverJKUAT,73829129.0,DiscoverJKUAT,False,False,,,,,,,,
225,1051133247927795722,Nzilleadam,Nzille,False,1598581045779128325,2022-12-02 07:33:16+00:00,"RT @DiscoverJKUAT: Hon. Ezekiel Machogu, CS Education: The wellbeing of our society is at stake, partly due to the challenge of alcohol and…",5,0,,DiscoverJKUAT,,,False,True,1.5985809305363456e+18,73829129.0,DiscoverJKUAT,Discover JKUAT,2022-12-02 07:32:48+00:00,"Hon. Ezekiel Machogu, CS Education: The wellbeing of our society is at stake, partly due to the challenge of alcohol and drug abuse.  This has seriously compromised the productivity and mental health of our youth.... ^DP  @StandardKenya  #JKUATPAUGrad2022",5.0,2.0
226,73829129,DiscoverJKUAT,Discover JKUAT,False,1598580930536345602,2022-12-02 07:32:48+00:00,"Hon. Ezekiel Machogu, CS Education: The wellbeing of our society is at stake, partly due to the challenge of alcohol and drug abuse.  This has seriously compromised the productivity and mental health of our youth.... ^DP  @StandardKenya  #JKUATPAUGrad2022",5,2,JKUATPAUGrad2022,StandardKenya,,,False,False,,,,,,,,
227,1468328134508695552,lSayLessl,SayLess 🇨🇦 John 16:13,False,1598565218892013568,2022-12-02 06:30:22+00:00,"@JSJamato It's actually sad to see how people view folks who stand at intersections w/signs asking for help.

Not many employers would hire someone with a mental condition, or experiencing drug misuse/ abuse.",0,1,,JSJamato,1250785554.0,JSJamato,False,False,,,,,,,,
228,1514814731852255235,Lone44Ranger,Jrocktx,False,1598541293600243713,2022-12-02 04:55:18+00:00,@JimCarrey Fewer pervert Hollywood types the better. You’re so out of touch with the world. Decades of a drug and alcohol abuse have ruined you. How many prostitutes have you exploited?  How many were under age ?  How many times have you knowingly passed a std ?  https://t.co/WNoBdnVY0D,0,0,,JimCarrey,52551600.0,JimCarrey,False,False,,,,,,,,
229,306616453,Samoskal,"😷🇺🇦 Steve Moskal Wear masks, its VIRAL LOAD",False,1598541050934865922,2022-12-02 04:54:20+00:00,"US news segment on homeless. Essentially, forced hospital with forced drugging followed by dumping people back onto the street with no follow up and go through horrible drug withdrawal &amp; more chronic ill-health is psychiatric abuse - #biorisks #brainhealth https://t.co/ViUhq6K0aU",0,0,"biorisks,brainhealth",,,,False,False,,,,,,,,
230,753460563422826496,foxglovecore,‍‍ ‍ 𝕽☹︎𝓐𝓓𝓚͟𝓘͟𝓛͟𝓛͟ ׅ⎖ ׅ⎖,False,1598538384267436033,2022-12-02 04:43:44+00:00,"⠀⠀

heavy depictions of gore  &amp;&amp;.  violence

ptsd,  truama,  verbal / physical  abuse
drug   abuse,  unhealthy   relationships
stockholm  syndrome,   sexual  themes
torture,   manipulation,   mental  illness
paranoia,  religion,  cults,  cannibalism.

⠀⠀",0,0,,,7.534605634228265e+17,foxglovecore,False,False,,,,,,,,
231,957658760331300865,tearslostinrain,Marilyn,False,1598484073407823872,2022-12-02 01:07:56+00:00,"@OfficialOMD In a time when people’s thoughts are no longer just affected by mental health issues, drug abuse and/or events in real life, but also by social media, it can be harder than ever to recognise warning signs. The project doesn’t just offer support, but also training courses.",0,4,,OfficialOMD,30004537.0,OfficialOMD,False,False,,,,,,,,
232,1453850628707561505,cRADypto,Cru Jones #33,False,1598475871526047745,2022-12-02 00:35:20+00:00,"@pierre_crypt0 Variety of mental illnesses we are witnessing. Not to be insensitive. This is a combination of intelligence, wealth, drug abuse, and opportunity.",0,0,,pierre_crypt0,590134700.0,pierre_crypt0,False,False,,,,,,,,
233,1519067913805701120,TST__Radio,Ryan Gable,False,1598461797266509825,2022-12-01 23:39:25+00:00,"@TucsonRomero @VisitTucsonAZ @TucsonChamber @cityoftucson The state of the city is crime, trash, homelessness, mental illness, drugs, and incompetent or negligent mayor. The state of the city is you telling police to stand down and not enforce the law. The state of the city is the enabling of chronic homelessness and drug abuse.",1,5,,"TucsonRomero,VisitTucsonAZ,TucsonChamber,cityoftucson",210931957.0,TucsonRomero,False,False,,,,,,,,
234,852010122624630786,bearcIawcore,‍ ‍ ❆. ‍𝓢𝓝𝓞𝓦 ╱ 𝐐𝐔𝐄𝐄𝐍,False,1598456951146704898,2022-12-01 23:20:09+00:00,"⠀⠀

heavy depictions of gore  &amp;&amp;.  violence

ptsd,  truama,  verbal / physical  abuse
drug   abuse,  unhealthy   relationships
stockholm  syndrome,   sexual  themes
torture,   manipulation,   mental  illness
paranoia,  religion,  cults,  cannibalism.

⠀⠀",0,0,,,8.520101226246308e+17,bearcIawcore,False,False,,,,,,,,
235,613899762,Amonstersmom1,I Want The Old Normal Back,False,1598442218322550787,2022-12-01 22:21:37+00:00,"@nevaeh_walker03 @BetteMidler @bookshelfbattle You know what else would help?  Mental health treatment.  I dare say the majority of the ""homeless"" on our streets suffer from severe mental illness due drug abuse.  Our country doesn't help but enables - making sure tax payers pay for their cell phones to contact dealers.",0,0,,"nevaeh_walker03,BetteMidler,bookshelfbattle",1.5860732833881293e+18,nevaeh_walker03,False,False,,,,,,,,
236,1476742116,personalfitnes3,PersonalFitness3🏋🏻‍♀️,False,1598432581858500655,2022-12-01 21:43:19+00:00,"Substance Abuse and Mental #Health Issues: Dealing with Drug or Alcohol Addiction and Co-Occurring Mental Health Problems https://t.co/7MPi8uOViX
LIKE ▪️ SHARE ▪️ COMMENT",0,0,Health,,,,False,False,,,,,,,,
